{
  "schema_version": 1,
  "project": "WARP",
  "stage": "2P-E-C0-A",
  "record_type": "binary-audit-gate-00-human-decision-real",
  "status": "AUTHORIZED_FOR_SINGLE_GATE",
  "note": "Registro REAL e separado da autorizacao humana do GATE 0 (reconfirmacao de proveniencia por metadados). Autoriza SOMENTE o GATE 0; NAO o executa nesta etapa; NAO coleta evidencias; NAO consulta o upstream; NAO autoriza o GATE 1 nem qualquer operacao. O merge deste registro NAO executa o GATE 0. STOP_PATH permanece disponivel.",
  "plan_ref": {
    "path": "client/warp-audit/binary-audit-plan.example.json"
  },
  "source_decision_ref": {
    "path": "client/warp-audit/decisions/core-path-decision-record-2026-07-31.json"
  },
  "gate": {
    "id": 0,
    "name": "PROVENANCE_RECONFIRMATION"
  },
  "decider": "BrunoMNoronha",
  "role": "Responsavel tecnico e mantenedor do projeto FaithRO - Laus Deo",
  "authority": "Responsavel tecnico e mantenedor do projeto FaithRO - Laus Deo",
  "channel": "ChatGPT - conversa do projeto FaithRO",
  "date": "2026-07-31",
  "decision": "APPROVE_GATE_0",
  "justification": "O GATE 0 (reconfirmacao de proveniencia por metadados) e a primeira verificacao do plano da auditoria binaria offline e nao materializa, baixa nem executa o binario. Autorizo exclusivamente essa reconfirmacao, por metadados publicos e oficiais, para confirmar a consistencia entre o plano FaithRO e o upstream oficial antes de qualquer decisao posterior. A autorizacao vale somente para o GATE 0 e sera executada em etapa futura e separada; nenhuma evidencia foi coletada aqui.",
  "authorized_scope": "Consultar SOMENTE metadados publicos e oficiais necessarios para reconfirmar: identidade do repositorio upstream; existencia do commit fixado; referencias, arvore e caminho declarado do artefato; identificadores Git de commit, arvore e blob; tamanho do blob quando exposto diretamente pela API de metadados; tags e releases relacionadas apenas por metadados; licenca e informacoes textuais de proveniencia; consistencia entre o plano FaithRO e o upstream oficial. Nenhum conteudo binario e acessado.",
  "allowed_methods": [
    "GitHub API de metadados",
    "GitHub web metadata",
    "GitHub connector",
    "git ls-remote",
    "endpoints de commit",
    "endpoints de arvore",
    "endpoints de refs",
    "metadados de tags",
    "metadados de releases",
    "licenca e documentacao textual"
  ],
  "prohibited_actions": [
    "clone",
    "fetch upstream",
    "pull upstream",
    "archive",
    "release asset",
    "blob binario",
    "conteudo do prebuilt",
    "materializacao",
    "extracao",
    "hashing do binario real",
    "inspecao PE",
    "Authenticode",
    "antivirus",
    "execucao",
    "sandbox",
    "cliente",
    "patches",
    "login",
    "VPS",
    "distribuicao",
    "alteracao do servidor"
  ],
  "conditions": [
    { "n": 1, "text": "A autorizacao vale somente para o GATE 0." },
    { "n": 2, "text": "A execucao ocorrera em etapa posterior e separada." },
    { "n": 3, "text": "Somente metadados publicos e oficiais podem ser consultados." },
    { "n": 4, "text": "GitHub API, connector, paginas de metadados e git ls-remote sao permitidos." },
    { "n": 5, "text": "Clone e fetch upstream sao proibidos." },
    { "n": 6, "text": "Archives e release assets sao proibidos." },
    { "n": 7, "text": "O conteudo do blob prebuilt nao pode ser acessado." },
    { "n": 8, "text": "Nenhuma URL direta do binario deve ser visitada ou registrada." },
    { "n": 9, "text": "Nenhum binario pode ser materializado." },
    { "n": 10, "text": "Nenhuma analise estatica ou dinamica e autorizada." },
    { "n": 11, "text": "Nenhuma sandbox pode ser criada." },
    { "n": 12, "text": "Nenhum cliente pode ser fornecido." },
    { "n": 13, "text": "Nenhuma VPS pode ser acessada." },
    { "n": 14, "text": "Qualquer inconsistencia interrompe o fluxo e retorna a decisao humana." },
    { "n": 15, "text": "STOP_PATH permanece disponivel." },
    { "n": 16, "text": "A aprovacao do GATE 0 nao autoriza o GATE 1." },
    { "n": 17, "text": "O merge do registro nao executa o GATE 0." }
  ],
  "authorizations": {
    "human_decision_required": true,
    "human_decision_received": true,
    "gate_selected": true,
    "provenance_reconfirmation_authorized": true,
    "gate_0_started": false,
    "gate_0_completed": false,
    "materialization_authorized": false,
    "hashing_authorized": false,
    "static_inspection_authorized": false,
    "local_security_scan_authorized": false,
    "external_reputation_upload_authorized": false,
    "sandbox_creation_authorized": false,
    "execution_without_client_authorized": false,
    "client_copy_provision_authorized": false,
    "execution_with_client_copy_authorized": false,
    "patch_review_authorized": false,
    "patch_application_authorized": false,
    "client_preparation_authorized": false,
    "vps_access_authorized": false,
    "test_account_authorized": false,
    "first_login_authorized": false,
    "distribution_authorized": false,
    "gate_1_authorized": false
  },
  "execution_state": "AUTHORIZED_NOT_STARTED",
  "rollback": "Registro documental: reverter o commit desta branch (antes do merge) ou abrir PR de reversao (apos integracao). A reversao Git nao apaga a decisao humana historica; a revogacao exige novo registro humano explicito. Nada foi materializado, consultado no upstream ou executado nesta etapa.",
  "notes": "Nenhuma consulta upstream foi realizada nesta etapa; nenhuma evidencia foi coletada; o GATE 0 permanece nao iniciado; nenhuma autorizacao transitiva; o GATE 1 continua proibido."
}
